<?xml version="1.0" encoding="UTF-8"?>

<!ELEMENT bookstore (book+)>
<!ELEMENT book (name,author,price)>
<!ELEMENT name (#PCDATA)>
<!ELEMENT author (#PCDATA)>
<!ELEMENT price (#PCDATA)>